"Oscillas Technologies, Inc.","Chicago, Illinois (Headquarters)",http://www.oscillas.com,Select Consulting Partner,,AWS Certified Solutions Architect - Associate,,,,,,,,,https://aws.amazon.com/partners/find/partnerdetails/?n=Oscillas%20Technologies%2C%20Inc.&id=0010L00001tCTdEQAW
USEN ICT Solutions CORPORATION,"品川区上大崎, 東京都 (Headquarters)",https://usen-ict.co.jp/,Select Technology Partner,,AWS Certified Solutions Architect - Associate,,,,,,,,,https://aws.amazon.com/partners/find/partnerdetails/?n=USEN%20ICT%20Solutions%20CORPORATION&id=0010L00001tCURnQAO
"ZHUHAI LCOLA TECHNOLOGY CO.,LTD","珠海市, Guangdong (Headquarters)",https://www.lcola.cn,Select Technology Partner,,,,,,,,,,,https://aws.amazon.com/partners/find/partnerdetails/?n=ZHUHAI%20LCOLA%20TECHNOLOGY%20CO.%2CLTD&id=0010L00001tCUXiQAO
Bloomz Inc,"Redmond, Washington (Headquarters)",http://www.bloomz.com,Select Technology Partner,,,,,,,,,,,https://aws.amazon.com/partners/find/partnerdetails/?n=Bloomz%20Inc&id=0010L00001tCVWbQAO
Hmcomm Inc.,"港区芝大門, 東京都 (Headquarters)",http://hmcom.co.jp/,Select Technology Partner,主な技術はディープラーニング音声認識処理、自然言語処理、自動要約処理となります。,,,,,,,,,,https://aws.amazon.com/partners/find/partnerdetails/?n=Hmcomm%20Inc.&id=0010L00001tCXEuQAO
Extreme Networks,"San Jose, California (Headquarters)",http://www.extremenetworks.com,Select Technology Partner,"Software-driven networking including Access Points, Campus Switches, Data Center, and cloud",AWS Certified Solutions Architect - Associate,,,,,,,,,https://aws.amazon.com/partners/find/partnerdetails/?n=Extreme%20Networks&id=0010L00001tCY6tQAG
OpenService,"Apodaca,  Nuevo León (Headquarters)",http://www.openservice.mx,Select Consulting Partner,"OpenService es una compañía apasionada por el servicio. En sus más de 20 años de existencia se ha encargado de ofrecer servicios de TI de alta calidad llenos de innovación. Con oficinas en Monterrey, Ciudad de México y Austin, OpenService ha tenido la oportunidad de colaborar con empresas de talla mundial asistiéndoles a alcanzar sus objetivos a través de servicios de alto valor.",AWS Certified Solutions Architect - Associate,,,,,,,,,https://aws.amazon.com/partners/find/partnerdetails/?n=OpenService&id=0010L00001tCYdSQAW
TribalScale,"Toronto, Ontario (Headquarters)",https://www.tribalscale.com/,Select Consulting Partner,"TribalScale is a global innovation firm specializing in world class digital products, product strategy, design & development for some of the world's top brands. TRANSFORMATION SERVICES. We teach enterprises our unique development approach to enable them to be more nimble. PROJECT SERVICES. We build world class web, mobile, OTT, IoT products. VENTURE STUDIOS: We build disruptive startups.","AWS Certified Solutions Architect - Associate,AWS Certified Developer - Associate",,,,,,,,,https://aws.amazon.com/partners/find/partnerdetails/?n=TribalScale&id=0010L00001tCYopQAG
junkshon,"Henley-On-Thames,, Oxford (Headquarters)",http://www.junkshon.com,Select Technology Partner,"Rapid, Software-driven Analysis & Insights to inform and enable your migration strategy Hundred's of years collective migration experience embedded into our purpose-built junkshon workload mobility analytics platform",,,,,,,,,,https://aws.amazon.com/partners/find/partnerdetails/?n=junkshon&id=0010L00001tCZmyQAG
Syncurity Corporation,"Bethesda, Maryland (Headquarters)",https://www.syncurity.net,Select Technology Partner,,,,,,,,,,,https://aws.amazon.com/partners/find/partnerdetails/?n=Syncurity%20Corporation&id=0010L00001tCbquQAC
Heidelberg mobil International GmbH,"Heidelberg, Baden-Wuerttemberg (Headquarters)",http://www.heidelberg-mobil.com,Select Technology Partner,,,,,,,,,,,https://aws.amazon.com/partners/find/partnerdetails/?n=Heidelberg%20mobil%20International%20GmbH&id=0010L00001tCcoTQAS
R&Y Labs,"Atlanta, Georgia (Headquarters)",http://www.rylabs.io,Select Technology Partner,,,,,,,,,,,https://aws.amazon.com/partners/find/partnerdetails/?n=R%26Y%20Labs&id=0010L00001tCdEPQA0
Bedrock Automation,"San Jose, California (Headquarters)",http://www.bedrockautomation.com,Select Technology Partner,,,,,,,,,,,https://aws.amazon.com/partners/find/partnerdetails/?n=Bedrock%20Automation&id=0010L00001tCeXYQA0
Seeq Corporation,"Seattle, Washington (Headquarters)",http://www.seeq.com,Select Technology Partner,"Seeq® enables process manufacturing organizations to rapidly investigate and share insights from time series data stored in any on premise historian, Amazon Redshift, and S3 data service. With diagnostic, monitoring, and predictive analytics powered by innovations in big data and machine learning technologies, helps organizations turn data into insights that drive process improvement and increase",,,,,,,,,,https://aws.amazon.com/partners/find/partnerdetails/?n=Seeq%20Corporation&id=0010L00001tCeZtQAK
Kaliop,"Montpellier, Hérault (Headquarters)",http://www.kaliop.fr,Select Consulting Partner,,"AWS Certified Solutions Architect - Associate,AWS Certified Sysops Administrator - Associate",,,,,,,,,https://aws.amazon.com/partners/find/partnerdetails/?n=Kaliop&id=0010L00001tCfAHQA0
Zycus,"Mumbai, Maharashtra (Headquarters)",http://www.zycus.com,Select Technology Partner,,,,,,,,,,,https://aws.amazon.com/partners/find/partnerdetails/?n=Zycus&id=0010L00001tCfRlQAK
MINT Media Interactive Software Systems GmbH,"Kiel, SH (Headquarters)",http://www.media-interactive.de,Select Technology Partner,,,,,,,,,,,https://aws.amazon.com/partners/find/partnerdetails/?n=MINT%20Media%20Interactive%20Software%20Systems%20GmbH&id=0010L00001tCfZ6QAK
"StrongBox Data Solutions, Inc","Montreal, Quebec (Headquarters)",http://www.strongboxdata.com,Select Technology Partner,,,,,,,,,,,https://aws.amazon.com/partners/find/partnerdetails/?n=StrongBox%20Data%20Solutions%2C%20Inc&id=0010L00001tCgWzQAK
Osprey Informatics,"Calgary, Alberta (Headquarters)",http://www.ospreyinformatics.com,Select Technology Partner,,,,,,,,,,,https://aws.amazon.com/partners/find/partnerdetails/?n=Osprey%20Informatics&id=0010L00001tCgkjQAC
AVANA,"PETALING JAYA, Selangor (Headquarters)",http://www.avana.asia,Select Technology Partner,,,,,,,,,,,https://aws.amazon.com/partners/find/partnerdetails/?n=AVANA&id=0010L00001tChnZQAS
Docbyte NV,"SINT-DENIJS-WESTREM, Oost-Vlaanderen (Headquarters)",http://www.docbyte.com,Select Technology Partner,,,,,,,,,,,https://aws.amazon.com/partners/find/partnerdetails/?n=Docbyte%20NV&id=0010L00001tCjgmQAC
Supahands,"Kuala Lumpur, Kuala Lumpur (Headquarters)",http://www.supahands.com,Select Technology Partner,,,,,,,,,,,https://aws.amazon.com/partners/find/partnerdetails/?n=Supahands&id=0010L00001tCmnWQAS
Prolucid Technologies,"Mississauga, Ontario (Headquarters)",http://www.prolucid.ca,Select Technology Partner,"Prolucid is a systems integration company that helps customers build and maintain secure Industrial IoT systems, including integration of edge devices with cloud applications and infrastructure. We also provide tools and services to apply machine learning and advanced analytics to extract useful information from the collected big data, enabling enhanced intelligence.",,,,,,,,,,https://aws.amazon.com/partners/find/partnerdetails/?n=Prolucid%20Technologies&id=0010L00001tCn2TQAS
Alcor Solutions Inc.,"Dublin, California (Headquarters)",http://www.alcortech.com,Select Consulting Partner,,"AWS Certified Solutions Architect - Associate,AWS Certified Developer - Associate",,,,,,,,,https://aws.amazon.com/partners/find/partnerdetails/?n=Alcor%20Solutions%20Inc.&id=0010L00001tCoELQA0
Pachyderm,"San Francisco, California (Headquarters)",http://www.pachyderm.io,Select Technology Partner,,,,,,,,,,,https://aws.amazon.com/partners/find/partnerdetails/?n=Pachyderm&id=0010L00001tCoIIQA0
TekValley,"Pleasanton, California (Headquarters)",http://www.tekvalley.com,Select Consulting Partner,"What sets TekValley apart is that we leave no gaps when it comes to fitting the right technologies and service model to the customer’s business. With over 80 US-based and 150 India-based technical experts encompassing the widest range of experience, tech disciplines, and industries.","AWS Certified Solutions Architect - Associate,AWS Certified Developer - Associate",,,,,,,,,https://aws.amazon.com/partners/find/partnerdetails/?n=TekValley&id=0010L00001tCoiHQAS
Peernova,"San Jose, California (Headquarters)",http://www.peernova.com,Select Technology Partner,,,,,,,,,,,https://aws.amazon.com/partners/find/partnerdetails/?n=Peernova&id=0010L00001tCoiMQAS
Elucipath Inc.,"Kanata, Ontario (Headquarters)",https://elucipath.com,Select Consulting Partner,"Elucipath is a small business serving clients in North America. We provide end to end custom application development, migration of applications including replatforming and refactoring, DevOps, monitoring, solution design/architecture, and cost optimization.","AWS Certified Developer - Associate,AWS Certified Solutions Architect - Associate",,,,,,,,,https://aws.amazon.com/partners/find/partnerdetails/?n=Elucipath%20Inc.&id=0010L00001tCpDPQA0
Kentik,"San Francisco, California (Headquarters)",http://www.kentik.com,Select Technology Partner,,,,,,,,,,,https://aws.amazon.com/partners/find/partnerdetails/?n=Kentik&id=0010L00001u3jbcQAA
GENY MEDIUM LABS PVT.LTD,"Hyderabad, Andrapradesh (Headquarters)",https://www.genylabs.io,Select Technology Partner,,,,,,,,,,,https://aws.amazon.com/partners/find/partnerdetails/?n=GENY%20MEDIUM%20LABS%20PVT.LTD&id=0010L00001u3ll7QAA
Learn on Demand Systems,"NEW PORT RICHEY, Florida (Headquarters)",http://www.learnondemandsystems.com,Select Technology Partner,"We work with customers to create, manage and deliver hands-on environments hosted on AWS. These environments are typically used for instructor-led classes, self-paced courses, events/conferences and software demos.",,,,,,,,,,https://aws.amazon.com/partners/find/partnerdetails/?n=Learn%20on%20Demand%20Systems&id=0010L00001u3lzGQAQ
Noovolari,"Pavia, PV (Headquarters)",http://www.noovolari.com,Select Technology Partner,"Noovolari is a set of management tools designed to help Cloud Pros to manage resources in a new smart way. Noovolari Smart Backup is a backup-as-a-service tool for managing backups and disaster-recovery of EC2, RDS, and Aurora, using native AWS snapshots. It takes care of data consistency, with its application-aware processing, and ensures reliability through cross-region and cross-account replica",,,,,,,,,,https://aws.amazon.com/partners/find/partnerdetails/?n=Noovolari&id=0010L00001u3oeVQAQ
Tiempo Development,"Tempe, Arizona (Headquarters)",http://www.tiempodev.com,Select Consulting Partner,,,,,,,,,,,https://aws.amazon.com/partners/find/partnerdetails/?n=Tiempo%20Development&id=0010L00001u3p9QQAQ
Hottolink Inc,"Chiyoda-Ku, Tokyo (Headquarters)",http://www.hottolink.co.jp,Select Technology Partner,,,,,,,,,,,https://aws.amazon.com/partners/find/partnerdetails/?n=Hottolink%20Inc&id=0010L00001u3rT6QAI
Cinqsmile,"Minatoku, Tokyo (Headquarters)",https://5smile.com,Select Technology Partner,,,,,,,,,,,https://aws.amazon.com/partners/find/partnerdetails/?n=Cinqsmile&id=0010L00001u3rtqQAA
SXiQ,"Melbourne, Victoria (Headquarters)",http://www.sxiq.com.au,Select Consulting Partner,"We help organisations with their Digital Transformation across three technology domains covering Employee Experience, Cloud Hosting and CyberSecurity. We have extensive skills in Public Cloud, Office 365, Identify Management, Business Workflow Automation, Application Modernisation and Security Advisory. See our website for more information","AWS Certified Sysops Administrator - Associate,AWS Certified Solutions Architect - Associate",,,,,,,,,https://aws.amazon.com/partners/find/partnerdetails/?n=SXiQ&id=0010L00001u3s3XQAQ
"BizConf Telecom Co.,Ltd","Shanghai, Shanghai (Headquarters)",http://www.bizconf.cn,Select Technology Partner,,,,,,,,,,,https://aws.amazon.com/partners/find/partnerdetails/?n=BizConf%20Telecom%20Co.%2CLtd&id=0010L00001u3s7wQAA
Somo,"Victoria, London (Headquarters)",https://www.somoglobal.com,Select Consulting Partner,,AWS Certified Solutions Architect - Associate,,,,,,,,,https://aws.amazon.com/partners/find/partnerdetails/?n=Somo&id=0010L00001u3sGuQAI
ZipRecruiter,"Santa Monica, California (Headquarters)",http://www.ziprecruiter.com,Select Technology Partner,,,,,,,,,,,https://aws.amazon.com/partners/find/partnerdetails/?n=ZipRecruiter&id=0010L00001u3sHOQAY
Rubikloud Technologies,"TORONTO, Ontario (Headquarters)",http://www.rubikloud.ai,Select Technology Partner,,,,,,,,,,,https://aws.amazon.com/partners/find/partnerdetails/?n=Rubikloud%20Technologies&id=0010L00001u3syTQAQ
VARADA,"Ramat Gan, Israel (Headquarters)",http://www.varada.io,Select Technology Partner,,,,,,,,,,,https://aws.amazon.com/partners/find/partnerdetails/?n=VARADA&id=0010L00001u3t6xQAA
Apption,"Ottawa, Ontario (Headquarters)",http://www.apption.com,Select Consulting Partner,"We work with organizations that need data-centric software solutions. Our client list includes government organizations handling financial transactions, health treatment and safety issues, statistics, tracking and service delivery. We work in the private sector with retailers, service providers, financial sector players enabling their businesses with advanced custom software solutions.",AWS Certified Solutions Architect - Associate,,,,,,,,,https://aws.amazon.com/partners/find/partnerdetails/?n=Apption&id=0010L00001u3tMjQAI
Identify3D,"San Mateo, California (Headquarters)",https://www.identify3d.com,Select Technology Partner,,,,,,,,,,,https://aws.amazon.com/partners/find/partnerdetails/?n=Identify3D&id=0010L00001u3tlqQAA
GClue,"Aizuwakamatsu, Fukushima (Headquarters)",http://www.gclue.jp,Select Technology Partner,,,,,,,,,,,https://aws.amazon.com/partners/find/partnerdetails/?n=GClue&id=0010L00001u3uI9QAI
eMagiz Services BV,"Enschede, Overijssel (Headquarters)",http://www.eMagiz.com,Select Technology Partner,,,,,,,,,,,https://aws.amazon.com/partners/find/partnerdetails/?n=eMagiz%20Services%20BV&id=0010L00001u3uvIQAQ
Auklet,"Troy, Michigan (Headquarters)",https://www.auklet.io,Select Technology Partner,"Auklet is the problem-solving software to quickly identify, monitor, and resolve issues across releases and hardware contexts. Auklet's featherweight error tracking and monitoring tool, allows developers to quickly triage errors and performance issues and resolve them quickly.",,,,,,,,,,https://aws.amazon.com/partners/find/partnerdetails/?n=Auklet&id=0010L00001u3vkdQAA
MobileLive Inc.,"Toronto, Ontario (Headquarters)",http://www.mobilelive.ca,Select Consulting Partner,,AWS Certified Solutions Architect - Associate,,,,,,,,,https://aws.amazon.com/partners/find/partnerdetails/?n=MobileLive%20Inc.&id=0010L00001u3yq2QAA
Springload Limited,"Wellington, Wellington (Headquarters)",https://www.springload.co.nz,Select Consulting Partner,,AWS Certified Sysops Administrator - Associate,,,,,,,,,https://aws.amazon.com/partners/find/partnerdetails/?n=Springload%20Limited&id=0010L00001u400pQAA
"CONCORE'S Co., Ltd.","日本橋箱崎町, 東京都 中央区 (Headquarters)",http://concores.co.jp/,Select Technology Partner,,,,,,,,,,,https://aws.amazon.com/partners/find/partnerdetails/?n=CONCORE%27S%20Co.%2C%20Ltd.&id=0010L00001u40FEQAY
"Zhengzhou Sinoart Information Technology Co., Ltd.","郑州, Henan (Headquarters)",http://www.yisainuo.com/,Select Consulting Partner,,AWS Certified Solutions Architect - Professional,,,,,,,,,https://aws.amazon.com/partners/find/partnerdetails/?n=Zhengzhou%20Sinoart%20Information%20Technology%20Co.%2C%20Ltd.&id=0010L00001u40ZfQAI
EducationCity Ltd,"Oakham, Rutland (Headquarters)",http://www.educationcity.com,Select Technology Partner,,,,,,,,,,,https://aws.amazon.com/partners/find/partnerdetails/?n=EducationCity%20Ltd&id=0010L00001u41E6QAI
"Shanghai Vechain information technology Co.,Ltd","Shanghai, Shanghai (Headquarters)",http://www.vechain.com,Select Technology Partner,,,,,,,,,,,https://aws.amazon.com/partners/find/partnerdetails/?n=Shanghai%20Vechain%20information%20technology%20Co.%2CLtd&id=0010L00001u41K0QAI
Opaq,"Herndon, Virginia (Headquarters)",http://www.opaq.com,Select Technology Partner,,,,,,,,,,,https://aws.amazon.com/partners/find/partnerdetails/?n=Opaq&id=0010L00001u422PQAQ
Q Engineering,"Houston, Texas (Headquarters)",http://www.q.engineering,Select Technology Partner,,,,,,,,,,,https://aws.amazon.com/partners/find/partnerdetails/?n=Q%20Engineering&id=0010L00001u42c8QAA
Accelteam Sdn Bhd,"Kuala Lumpur, AP (Headquarters)",http://www.accelteam.com,Select Technology Partner,,,,,,,,,,,https://aws.amazon.com/partners/find/partnerdetails/?n=Accelteam%20Sdn%20Bhd&id=0010L00001u43LdQAI
Data2Performance AG,"Baar, Zug (Headquarters)",http://www.data2performance.com,Select Technology Partner,,,,,,,,,,,https://aws.amazon.com/partners/find/partnerdetails/?n=Data2Performance%20AG&id=0010L00001u43aNQAQ
First Derivatives plc,"NEWRY, DOWN (Headquarters)",http://www.firstderivatives.com,Select Consulting Partner,"First Derivatives is a leading provider of solutions and services to some of the world’s largest finance, technology and energy institutions. The Company scopes, designs, develops, implements and supports a broad range of mission-critical data and trading systems. As a first mover and influencer, we are on the leading edge of AWS migration efforts across our global client base.","AWS Certified Solutions Architect - Associate,AWS Certified Developer - Associate",,,,,,,,,https://aws.amazon.com/partners/find/partnerdetails/?n=First%20Derivatives%20plc&id=0010L00001u442fQAA
StreamWeaver,"New York, New York (Headquarters)",http://www.streamweaver.com,Select Technology Partner,,,,,,,,,,,https://aws.amazon.com/partners/find/partnerdetails/?n=StreamWeaver&id=0010L00001u476gQAA
Apiphani,"Cambridge, Massachusetts (Headquarters)",http://www.apiphani.io,Select Consulting Partner,apiphani is a technology enabled services company dedicated to helping businesses minimize the effort and risk associated with managing tier SAP applications. By integrating decades of SAP managed services experience with intelligent automation and machine learning we are able to drive extreme efficiency and reliability in support of our client's mission critical workloads.,AWS Certified Solutions Architect - Associate,,,,,,,,,https://aws.amazon.com/partners/find/partnerdetails/?n=Apiphani&id=0010L00001u47reQAA
Active Intelligence Pte Ltd,"Singapore, Singapore (Headquarters)",https://www.active.ai,Select Technology Partner,,,,,,,,,,,https://aws.amazon.com/partners/find/partnerdetails/?n=Active%20Intelligence%20Pte%20Ltd&id=0010L00001u487rQAA
Retter,"Istanbul, Istanbul (Headquarters)",http://www.rettermobile.com,Select Consulting Partner,,"AWS Certified Solutions Architect - Associate,AWS Certified Developer - Associate",,,,,,,,,https://aws.amazon.com/partners/find/partnerdetails/?n=Retter&id=0010L00001u48o7QAA
"Kogence, Inc.","Mountain View, California (Headquarters)",https://www.kogence.com,Select Technology Partner,,,,,,,,,,,https://aws.amazon.com/partners/find/partnerdetails/?n=Kogence%2C%20Inc.&id=0010L00001u4AcSQAU
inGenious AI,"Melbourne, Victoria (Headquarters)",http://www.ingenious.ai,Select Technology Partner,"At inGenious.AI, we create engaging, informative and useful conversational interfaces (CIs), enabling customers to communicate with companies in the same way as they would with their friends. We specialise in providing an enjoyable, effective one-to-one customer experience via chatbots, which are scalable and comparatively low cost.",,,,,,,,,,https://aws.amazon.com/partners/find/partnerdetails/?n=inGenious%20AI&id=0010L00001u4B6wQAE
Distrii,"Shanghai, Shanghai (Headquarters)",http://www.distrii.com,Select Technology Partner,,,,,,,,,,,https://aws.amazon.com/partners/find/partnerdetails/?n=Distrii&id=0010L00001u4BjPQAU
HAIZHI,"上海, Shanghai (Headquarters)",http://www.ruyi.ai,Select Technology Partner,,,,,,,,,,,https://aws.amazon.com/partners/find/partnerdetails/?n=HAIZHI&id=0010L00001u4BrlQAE
Brushup Inc.,"大阪市北区大深町, 大阪府 (Headquarters)",https://www.brushup-inc.com,Select Technology Partner,,,,,,,,,,,https://aws.amazon.com/partners/find/partnerdetails/?n=Brushup%20Inc.&id=0010L00001u4BuGQAU
Netland Co. Ltd,"港区六本木, 東京都 (Headquarters)",http://www.net-land.co.jp,Select Technology Partner,,,,,,,,,,,https://aws.amazon.com/partners/find/partnerdetails/?n=Netland%20Co.%20Ltd&id=0010L00001u4FXDQA2
Digiasa Inc.,"大阪市, 大阪府 (Headquarters)",https://digiasa.co.jp/,Select Consulting Partner,,"AWS Certified Solutions Architect - Associate,AWS Certified Sysops Administrator - Associate,AWS Certified Developer - Associate",,,,,,,,,https://aws.amazon.com/partners/find/partnerdetails/?n=Digiasa%20Inc.&id=0010L00001u4FmuQAE
Nissin Infomation System LTD,"大阪市中央区内本町, 大阪府 (Headquarters)",https://www.nissinjoho.co.jp/,Select Technology Partner,,,,,,,,,,,https://aws.amazon.com/partners/find/partnerdetails/?n=Nissin%20Infomation%20System%20LTD&id=0010L00001u4FqSQAU
GovernancaBrasil SA,"Blumenau, Santa Catarina (Headquarters)",http://www.govbr.com.br,Select Technology Partner,,,,,,,,,,,https://aws.amazon.com/partners/find/partnerdetails/?n=GovernancaBrasil%20SA&id=0010L00001u4FtvQAE
"Code Climate, Inc","New York, New York (Headquarters)",https://www.codeclimate.com/,Select Technology Partner,,,,,,,,,,,https://aws.amazon.com/partners/find/partnerdetails/?n=Code%20Climate%2C%20Inc&id=0010L00001u4IKcQAM
"Voyant, Inc.","AUSTIN, Texas (Headquarters)",http://www.planwithvoyant.com,Select Technology Partner,,,,,,,,,,,https://aws.amazon.com/partners/find/partnerdetails/?n=Voyant%2C%20Inc.&id=0010L00001u4IO5QAM
"INDO SISTEM GLOBAL, PT","Cirebon, DKI Jakarta (Headquarters)",http://www.indosystem.com,Select Technology Partner,,AWS Certified Solutions Architect - Associate,,,,,,,,,https://aws.amazon.com/partners/find/partnerdetails/?n=INDO%20SISTEM%20GLOBAL%2C%20PT&id=0010L00001u4IptQAE
chengdu Yuangaofen,"成都, Sichuan (Headquarters)",http://www.yuangaofen.com,Select Technology Partner,,,,,,,,,,,https://aws.amazon.com/partners/find/partnerdetails/?n=chengdu%20Yuangaofen&id=0010L00001u4JE5QAM
"Falcon System Consulting,INC","川崎市高津区坂戸, 神奈川県 (Headquarters)",http://www.falconsc.com/,Select Technology Partner,,,,,,,,,,,https://aws.amazon.com/partners/find/partnerdetails/?n=Falcon%20System%20Consulting%2CINC&id=0010L00001u4K8xQAE
Lixar,"Ottawa, Ontario (Headquarters)",http://www.lixar.com,Select Consulting Partner,,AWS Certified Solutions Architect - Associate,,,,,,,,,https://aws.amazon.com/partners/find/partnerdetails/?n=Lixar&id=0010L00001u4KQNQA2
Mobilenik,"CABA, Buenos Aires City (Headquarters)",https://www.mobilenik.com,Select Technology Partner,,,,,,,,,,,https://aws.amazon.com/partners/find/partnerdetails/?n=Mobilenik&id=0010L00001u4KX1QAM
Betterez Canada Inc.,"Toronto, Ontario (Headquarters)",http://www.betterez.com,Select Technology Partner,,,,,,,,,,,https://aws.amazon.com/partners/find/partnerdetails/?n=Betterez%20Canada%20Inc.&id=0010L00001u4LplQAE
SOFTURA,"Farmington Hills, Michigan (Headquarters)",http://www.softura.com,Select Consulting Partner,,AWS Certified Solutions Architect - Associate,,,,,,,,,https://aws.amazon.com/partners/find/partnerdetails/?n=SOFTURA&id=0010L00001u4MY0QAM
NEXTSCAPE INC.,"新宿区西新宿小田急第一生命ビル, 東京都 (Headquarters)",https://www.nextscape.net/,Select Technology Partner,"NEXTSCAPE's Multi DRM Kit is an API-based DRM service covering all major DRMs, Microsoft PlayReady, Google Widevine, and Apple FairPlay Streaming. Multi DRM Kit reduces the complexity of implementing DRM features with presets and code samples. NEXTSCAPE is also a technology parnter of AWS Elemental.",,,,,,,,,,https://aws.amazon.com/partners/find/partnerdetails/?n=NEXTSCAPE%20INC.&id=0010L00001u4MbTQAU
"If You Can, LLC","Weldon Spring, Missouri (Headquarters)",https://www.ifyoucan.com,Select Technology Partner,,,,,,,,,,,https://aws.amazon.com/partners/find/partnerdetails/?n=If%20You%20Can%2C%20LLC&id=0010L00001u4Tt8QAE
ManoGroup,"Quito, Pichincha (Headquarters)",https://www.manogroup.io,Select Consulting Partner,"ManoGroup helps businesses tap the power of the Amazon Web Services Cloud with a 100% focus on our clients success, we provide our expertise, based on proven results, across security, devops, kubernetes and IaC technologies. Designing, building and implementing world-class infrastructures that satisfy your current and future business needs.","AWS Certified Solutions Architect - Associate,AWS Certified Developer - Associate",,,,,,,,,https://aws.amazon.com/partners/find/partnerdetails/?n=ManoGroup&id=0010L00001u4UO8QAM
Moff Inc.,"千代田区, 東京都 (Headquarters)",http://jp.moff.mobi,Select Technology Partner,,,,,,,,,,,https://aws.amazon.com/partners/find/partnerdetails/?n=Moff%20Inc.&id=0010L00001u4URgQAM
"Transn IOL Technology Co.,Ltd.","Beijing, Beijing (Headquarters)",http://www.iol8.com,Select Technology Partner,,,,,,,,,,,https://aws.amazon.com/partners/find/partnerdetails/?n=Transn%20IOL%20Technology%20Co.%2CLtd.&id=0010L00001u4UszQAE
NTT DATA Italia S.p.A.,"Milan, MI (Headquarters)",http://www.nttdata.com/it,Select Consulting Partner,,"AWS Certified Solutions Architect - Associate,AWS Certified Developer - Associate",,,,,,,,,https://aws.amazon.com/partners/find/partnerdetails/?n=NTT%20DATA%20Italia%20S.p.A.&id=0010L00001u4V1hQAE
Onfido,"London, Greater London (Headquarters)",https://www.onfido.com,Select Technology Partner,,,,,,,,,,,https://aws.amazon.com/partners/find/partnerdetails/?n=Onfido&id=0010L00001u4VIfQAM
