M-SQUARE PTY LTD,"Sydney, New South Wales (Headquarters)",https://www.m-square.com.au,Select Consulting Partner,Consulting Services Startup friendly Assessment / Jumpstart Pkg DevOps / CI / CD / Automation Cloud Migration Services Strategic / IT Consulting Visit our website for more details: www.m-square.com.au,AWS Certified Solutions Architect - Associate,,,,,,,,,https://aws.amazon.com/partners/find/partnerdetails/?n=M-SQUARE%20PTY%20LTD&id=001E000000iLklOIAS
WinMagic,"Mississauga, Ontario (Headquarters)",http://www.winmagic.com,Select Technology Partner,"At WinMagic, we know the need to secure data is critical for compliance, yet often disruptive to business operations. Our mission is to make encryption simple, scalable and secure for data stored across your distributed endpoints, datacenter and cloud infrastructure. SecureDoc CloudVM protects virtual machines across hybrid architecture environments with enterprise control of keys and policies.",AWS Certified Solutions Architect - Associate,,,,,,,,,https://aws.amazon.com/partners/find/partnerdetails/?n=WinMagic&id=001E000000iM8lYIAS
Universal Shell Programming Laboratory Ltd,"Minato-ku, Tokyo (Headquarters)",http://www.usp-lab.com,Select Technology Partner,,,,,,,,,,,https://aws.amazon.com/partners/find/partnerdetails/?n=Universal%20Shell%20Programming%20Laboratory%20Ltd&id=001E000000iN1XlIAK
NMR,"London, Greater London (Headquarters)",http://www.nmr.com,Select Consulting Partner,"We have a deep understanding of complex media workflows and the high performance technology requirements that support them. Customers include major broadcasters, global advertising agencies, Fortune 500 /FTSE 100 , utilities, and include some of the world's most recognisable brands.",AWS Certified Solutions Architect - Associate,,,,,,,,,https://aws.amazon.com/partners/find/partnerdetails/?n=NMR&id=001E000000iN6IXIA0
Movio,"Auckland, North Island (Headquarters)",http://movio.co/,Select Technology Partner,"Over 36 million moviegoers Movio is the global leader in marketing data analytics and campaign management software for cinema exhibitors, film distributors and studios. Movio’s mission is to revolutionize the way the film industry interacts with moviegoers.",,,,,,,,,,https://aws.amazon.com/partners/find/partnerdetails/?n=Movio&id=001E000000iNBvsIAG
Sistem Robotik Software Limited,"BURSA, Osmangazi (Headquarters)",http://www.sistemrobotik.com,Select Technology Partner,"Sistem Robotik Software Limited. is an internet project development company. We develop new internet projects and purpose to produce innovative and functional projects and services with our high qualified staff. Experience: Adserving, standalone, blind or demand-side ad platform topology creation, data mining, measurement and analytics, artificial intelligence soft engine development. Pr",,,,,,,,,,https://aws.amazon.com/partners/find/partnerdetails/?n=Sistem%20Robotik%20Software%20Limited&id=001E000000iNEfOIAW
"Agistix, Inc.","San Mateo, CALIFORNIA (Headquarters)",http://www.agistix.com,Select Technology Partner,"Global supply chain Visibility has taken on new meaning & complexity with the dawn of 'big data' ~ supplier routing compliance, low-cost service selection, carrier on-time performance, exception management, invoice accuracy & timeliness, etc. We work with clients of all sizes to centralize, normalize and automate global shipment data across all carriers, modes, and service levels. We take data fee",,,,,,,,,,https://aws.amazon.com/partners/find/partnerdetails/?n=Agistix%2C%20Inc.&id=001E000000iNLw8IAG
Skymill,"Malmö, Skåne (Headquarters)",https://www.skymill.io,Select Consulting Partner,"As experts within cloud infrastructure and operations, Skymill offers services ranging from design to implementation and maintenance of small or large server platforms. Everything we do focuses on scalability, performance, availability and security.",AWS Certified Solutions Architect - Associate,,,,,,,,,https://aws.amazon.com/partners/find/partnerdetails/?n=Skymill&id=001E000000iOgIcIAK
Mr. APPs srl,"Acquaviva, San Marino (Headquarters)",http://www.mr-apps.com/,Select Technology Partner,"Our services are aimed at companies/enterprise, whose purpose is: to optimize the work schedule to improve the communication with the clients to obtain new visibility for the products and services",,,,,,,,,,https://aws.amazon.com/partners/find/partnerdetails/?n=Mr.%20APPs%20srl&id=001E000000iOvfQIAS
eZ-Xpo,"San Francisco, Ca (Headquarters)",http://Ez-xpo.com,Select Technology Partner,,,,,,,,,,,https://aws.amazon.com/partners/find/partnerdetails/?n=eZ-Xpo&id=001E000000iP1HCIA0
Pro-Ship Incorporated,"Bunkyo-ku, Tokyo (Headquarters)",http://www.proship.co.jp/,Select Technology Partner,"【Company Profile】 Since 1969, Pro-Ship has expanded the business specialized in management of fixed assets. We stored advanced know-how and built the structure which is able to respond to more detailed needs from customers in the process of developing and improving package systems based on a lot of customers feedbacks. We have a speciality focused on fixed assets and provide trust and",,,,,,,,,,https://aws.amazon.com/partners/find/partnerdetails/?n=Pro-Ship%20Incorporated&id=001E000000j9Q7NIAU
Nosunset Consulting ApS,"Vejle, Danmark (Headquarters)",http://www.nosunset.com,Select Consulting Partner,"NOSUNSET develops web projects running on AWS. We assist our clients with .Net development, cloud hosting support and solution maintenance. We are a digital consultancy agency specializing in e-business solutions. We are especially focused on Nopcommerce and Umbraco solutions integrated with Microsoft Dynamics NAV, Dynamics CRM and Dynamics C5.",AWS Certified Solutions Architect - Associate,,,,,,,,,https://aws.amazon.com/partners/find/partnerdetails/?n=Nosunset%20Consulting%20ApS&id=001E000000j9QVUIA2
Toyo Business Engineering Corporation,"Chiyoda-ku, Tokyo (Headquarters)",http://www.to-be.co.jp/,Select Technology Partner,"In 1991, the company entered into an partner agreement with SAP AG for R/2 system as the first partner in Japan( The first partner of SAP in Japan ). In 1993, B-EN-G concluded an national logo partner agreement with SAP Japan that was just established in the previous year. The 1st and the 2nd SAP R/3 implementation project were successfully archived by B-EN-G in 1994 and 1995. Since then,","AWS Certified Sysops Administrator - Associate,AWS Certified Solutions Architect - Associate,AWS Certified Developer - Associate,AWS Certified Solutions Architect - Professional",,,,,,,,,https://aws.amazon.com/partners/find/partnerdetails/?n=Toyo%20Business%20Engineering%20Corporation&id=001E000000j9QYdIAM
Hsenid Business Solutions (PVT) Ltd.,"Colombo 03, Western (Headquarters)",http://www.hsenid.com,Select Technology Partner,"hSenid is an Application and Service provider for the Telecom, Financial and Enterprise markets. We specialize in Human Resource Applications and Mobile Applications and are also widely recognized for its reliable offshore/outsourcing capabilities. With a staff of over 500 skilled engineers worldwide, hSenid offers the best solutions for your business. Our clients include Telcel(Mexico), Lucent",AWS Certified Solutions Architect - Associate,,,,,,,,,https://aws.amazon.com/partners/find/partnerdetails/?n=Hsenid%20Business%20Solutions%20(PVT)%20Ltd.&id=001E000000j9fKwIAI
QuantumIT,"Carlton, Victoria (Headquarters)",http://www.quantumit.com.au,Select Consulting Partner,"QuantumIT is an independent software company delivering better business outcomes through smart solutions. Our consulting services include Data Migration, Business Intelligence, Data Warehousing and Application Development. QuantumIT is the developer and vendor of InPlace - the world’s smartest integrated learning placement solutions for universities which is offered through Cloud platforms to c","AWS Certified Developer - Associate,AWS Certified Solutions Architect - Associate",,,,,,,,,https://aws.amazon.com/partners/find/partnerdetails/?n=QuantumIT&id=001E000000jAVu7IAG
LatentView,"Chennai, Tamil Nadu (Headquarters)",http://www.latentview.com/,Select Consulting Partner,"LatentView helps clients develop and deploy result-oriented analytics solutions that enable them to make smarter decisions using their data. Our solutions help clients improve marketing performance, efficiently trade-off risks against available opportunities, maximize customer value, and increase employee effectiveness","AWS Certified Developer - Associate,AWS Certified Solutions Architect - Professional,AWS Certified Solutions Architect - Associate",,,,,,,,,https://aws.amazon.com/partners/find/partnerdetails/?n=LatentView&id=001E000000jAYeKIAW
Systax,"São Paulo, SP (Headquarters)",http://www.systax.com.br,Select Technology Partner,"Systax is a focused on Tax Inteligence solutions. Our goal is to translate the complex tax regulation in Brazil to business solutions that help our customers to be in compliance with these regulations and also extract the most of its analytics, using tax information as an competitive advantage to their operations.",AWS Certified Solutions Architect - Associate,,,,,,,,,https://aws.amazon.com/partners/find/partnerdetails/?n=Systax&id=001E000000jAYlKIAW
"CTMI, LLC","Dallas, TX (Headquarters)",http://www.ctmi.com,Select Technology Partner,"CTMI, LLC develops proprietary data analytics to identify and obtain previously unreported reimbursement and recovery opportunities on behalf of a wide range of clients. Our expertise in state and local tax and accounts payable processes enables us to recover reimbursement for companies around the country. By integrating web enabled software, analytics, and technical research, CTMI produces tim",,,,,,,,,,https://aws.amazon.com/partners/find/partnerdetails/?n=CTMI%2C%20LLC&id=001E000000jAg6yIAC
"MagRabbit, Inc.","Cedar Park, TX - Texas (Headquarters)",http://www.magrabbit.com,Select Consulting Partner,We offer a full range of today’s IT Consulting and custom application development services to meet your important business needs. MagRabbit delivers best-value solutions and services “anywhere & anytime” to customers located around the world. MagRabbit offers turnkey custom application development services to meet all of your technology needs. We are committed to delivering the highest q,"AWS Certified Solutions Architect - Associate,AWS Certified Developer - Associate",,,,,,,,,https://aws.amazon.com/partners/find/partnerdetails/?n=MagRabbit%2C%20Inc.&id=001E000000jAhf6IAC
Acrotrend,"London, Greater London (Headquarters)",http://www.acrotrend.com,Select Consulting Partner,"At Acrotrend we apply big data tech, customer analytics and AI to accelerate your digital transformation and business growth by taking you from Data > Insight > Action using: - Best of breed technology from AWS, Talend, Snowflake and Looker - Deep expertise in Data Science and Machine Learning - Deep expertise of building Data Warehousing & Data Lake solutions",AWS Certified Solutions Architect - Associate,,,,,,,,,https://aws.amazon.com/partners/find/partnerdetails/?n=Acrotrend&id=001E000000jAnsBIAS
Comcast Business,"Philadelphia, PA (Headquarters)",http://www.business.comcast.com/enterprise,Select Technology Partner,"Comcast Business offers private, layer 2 Ethernet connections to Amazon AWS that deliver a dependable network experience to your cloud computing initiatives. With Comcast Business you can enjoy a secure, private connection and reliable, consistent performance to AWS. For more information please visit","AWS Certified Solutions Architect - Associate,AWS Certified Sysops Administrator - Associate",,,,,,,,,https://aws.amazon.com/partners/find/partnerdetails/?n=Comcast%20Business&id=001E000000jAo8FIAS
BIT Software,"Brasov, Brasov (Headquarters)",http://www.bitsoftware.eu,Select Technology Partner,,,,,,,,,,,https://aws.amazon.com/partners/find/partnerdetails/?n=BIT%20Software&id=001E000000jAvwrIAC
Finpacific Pty Ltd,"Sydney, New South Wales (Headquarters)",http://www.finpacific.com,Select Technology Partner,,,,,,,,,,,https://aws.amazon.com/partners/find/partnerdetails/?n=Finpacific%20Pty%20Ltd&id=001E000000jB8dSIAS
Ricoh Japan,"Minato-ku, Tokyo (Headquarters)",https://www.ricoh.co.jp/sales/about/,Select Consulting Partner,"Ricoh Japan is a leading provider of total solutions for corporate offices that are Business consulting including business practice improvement, Systems design, and After service, while Ricoh Japan provides full range of RICOH Products such as OA machines, Communication devices and related products, or expendables.","AWS Certified Solutions Architect - Associate,AWS Certified Sysops Administrator - Associate,AWS Certified Solutions Architect - Professional,AWS Certified Developer - Associate",,,,,,,,,https://aws.amazon.com/partners/find/partnerdetails/?n=Ricoh%20Japan&id=001E000000jBHf4IAG
,,,,,,,,,,,,,,https://aws.amazon.com/partners/find/partnerdetails/?n=Webo&id=001E000000jBXoKIAW
Feedback Processi Logici srl,"Milano, MI (Headquarters)",http://www.fbk.it,Select Technology Partner,,,,,,,,,,,https://aws.amazon.com/partners/find/partnerdetails/?n=Feedback%20Processi%20Logici%20srl&id=001E000000jC3NDIA0
Skyresponse,"Stockholm, Stockholm (Headquarters)",http://Skygd.se,Select Technology Partner,,,,,,,,,,,https://aws.amazon.com/partners/find/partnerdetails/?n=Skyresponse&id=001E000000jC7wsIAC
"PCI Strategic Management, LLC","Columbia, MD (Headquarters)",http://www.gopci.com,Select Consulting Partner,"Our professionals assist our clients in developing timely, efficient solutions to complex technical and management challenges. Core capabilities include: Cloud architecture planning and design, application migration and security, strategic planning; quality assurance/control; risk management; analysis of alternatives; agile IV&V methodology; Platform (PaaS) and Test (TaaS) as a Service.","AWS Certified Developer - Associate,AWS Certified Solutions Architect - Associate,AWS Certified Sysops Administrator - Associate",,,,,,,,,https://aws.amazon.com/partners/find/partnerdetails/?n=PCI%20Strategic%20Management%2C%20LLC&id=001E000000jCD8vIAG
Platfora,"San Mateo, CA (Headquarters)",http://www.platfora.com,Select Technology Partner,,,,,,,,,,,https://aws.amazon.com/partners/find/partnerdetails/?n=Platfora&id=001E000000jCFfOIAW
デジタル・インフォメーション・テクノロジー株式会社,"Chuo-ku, Tokyo (Headquarters)",https://www.ditgroup.jp/,Select Consulting Partner,"Digital Information Technologies Corporation is an independent information services company. Our sales are mostly from the development of business systems, embedded devices, original products, etc. Our clients are in the fields of finance, communications, and automotive semiconductor among others. For more information, please visit https://www.ditgroup.jp","AWS Certified Sysops Administrator - Associate,AWS Certified Solutions Architect - Associate,AWS Certified Developer - Associate,AWS Certified Solutions Architect - Professional",,,,,,,,,https://aws.amazon.com/partners/find/partnerdetails/?n=%E3%83%87%E3%82%B8%E3%82%BF%E3%83%AB%E3%83%BB%E3%82%A4%E3%83%B3%E3%83%95%E3%82%A9%E3%83%A1%E3%83%BC%E3%82%B7%E3%83%A7%E3%83%B3%E3%83%BB%E3%83%86%E3%82%AF%E3%83%8E%E3%83%AD%E3%82%B8%E3%83%BC%E6%A0%AA%E5%BC%8F%E4%BC%9A%E7%A4%BE&id=001E000000jCL3KIAW
ANEO,"Boulogne Billancourt, Haut de Seine (Headquarters)",http://www.aneo.fr,Select Consulting Partner,,"AWS Certified Solutions Architect - Associate,AWS Certified Developer - Associate,AWS Certified Sysops Administrator - Associate",,,,,,,,,https://aws.amazon.com/partners/find/partnerdetails/?n=ANEO&id=001E000000jCWvaIAG
GENETEC CORPORATION,"shinjuku-ku, Tokyo-to (Headquarters)",http://www.genetec.co.jp,Select Technology Partner,"GENETEC CORPORATION. Embedded software development mobile communications, automotive, digital consumer electronics. Hardware development ASIC, such as FPGA design. Technical support and CAD / CAM software import and sale. Businesses such as development and sales of IT systems. Company name : GENETEC Co. President and CEO : Kenji Ueno Start-up : Jul",,,,,,,,,,https://aws.amazon.com/partners/find/partnerdetails/?n=GENETEC%20CORPORATION&id=001E000000jCaamIAC
Asgent.Inc,"Tokyo, Japan (Headquarters)",http://splus.asgent.co.jp/aws/,Select Consulting Partner,"Asgent Inc. (JASDAQ: code 4288) is a leading security solution provider since 1997. [SecurityPlus(TM) Security Service] Asgent provides total security service under the brand name of ""SecurityPlus"". The menus are comprising a wide range of security services, provides for the security needs of various range of enterprise customers. These services are founded on Asgent's wid",AWS Certified Solutions Architect - Associate,,,,,,,,,https://aws.amazon.com/partners/find/partnerdetails/?n=Asgent.Inc&id=001E000000jCcOIIA0
"ONOCOMM CO.,LTD","Osaka-shi, Osaka (Headquarters)",http://www.onocomm.co.jp/,Select Consulting Partner,株式会社アクティヴィジョン アント・キャピタル・パートナーズ株式会社 株式会社インターネットイニシアティブ 株式会社エムジェマ 株式会社クヌム Coltテクノロジーサービス株式会社 株式会社コンフィデンス さくらインターネット株式会社 株式会社サンパック 全国ビジネスサポート協同組合連合会 株式会社本間ゴルフ 株式会社マインドウェイブ 有限会社まんてん堂 株式会社麦の穂,AWS Certified Solutions Architect - Associate,,,,,,,,,https://aws.amazon.com/partners/find/partnerdetails/?n=ONOCOMM%20CO.%2CLTD&id=001E000000jCi7LIAS
Designet,"Sudbury, MA (Headquarters)",http://www.designet.com,Select Technology Partner,,,,,,,,,,,https://aws.amazon.com/partners/find/partnerdetails/?n=Designet&id=001E000000jCiOcIAK
Vivende,"Oslo, Oslo (Headquarters)",http://www.vivende.no,Select Technology Partner,We are a consultancy solely based on senior application development consultants with long experience delivering value at customers. We work mainly on Java and .NET platforms and have been working with AWS solutions since 2010.,,,,,,,,,,https://aws.amazon.com/partners/find/partnerdetails/?n=Vivende&id=001E000000jCiSUIA0
Multiedro Serviços de TI Ltda,"São Paulo, SP (Headquarters)",http://vempranuvem.com,Select Consulting Partner,Our goal is to accelerate business adoption of the cloud. Multiedro has a proven track record of implementing mission-critical solutions and helping organizations to reduce IT expenses. We were also able to deliver improvements in office routines. We differentiate from other integrators by having a full stack development team in order to fill the gaps cloud solutions still have.,AWS Certified Solutions Architect - Associate,,,,,,,,,https://aws.amazon.com/partners/find/partnerdetails/?n=Multiedro%20Servi%C3%A7os%20de%20TI%20Ltda&id=001E000000jCrHzIAK
Stealth Communications,"New York, New York (Headquarters)",http://https:/.stealth.net,Select Technology Partner,"Established in 1995, Stealth Communications provides Internet and data connectivity to businessses across NYC, completely over its own fiber infrastructure. Laying every single cable and using the latest in photonics technology, we offer the City's fastest and most reliable services at a competitve rates. Learn more at www.stealth.net",,,,,,,,,,https://aws.amazon.com/partners/find/partnerdetails/?n=Stealth%20Communications&id=001E000000jCweUIAS
Neodoo Microsystems S.L.,"Zaragoza, Zaragoza (Headquarters)",http://www.neodoo.es,Select Technology Partner,"Middleware technologies: Software development based on open source middleware platforms, especially with project from the Apache Foundation and the JBoss Community Java EE containers: Tomcat, WildFly / JBoss EAP, ActiveMQ ESB containers: Service Mix, JBoss FUSE Cloud computing: Linux Platforms Docker, Kubernetes and Ansible",,,,,,,,,,https://aws.amazon.com/partners/find/partnerdetails/?n=Neodoo%20Microsystems%20S.L.&id=001E000000jD2b7IAC
Buckhill Ltd,"Reading, Berkshire (Headquarters)",https://www.buckhill.co.uk/,Select Consulting Partner,"IT and Software Engineering Experts, helping you to solve tomorrow's challenges today. We love new challenges and we're ready to take on yours. Cloud Migration Specialists Managed DevOps InsurTech Software Solutions Identity and Access Management Solutions",AWS Certified Solutions Architect - Associate,,,,,,,,,https://aws.amazon.com/partners/find/partnerdetails/?n=Buckhill%20Ltd&id=001E000000jDMeHIAW
OAE Software,"Orlando, FL (Headquarters)",http://www.stratexpartners.com,Select Technology Partner,,"AWS Certified Solutions Architect - Associate,AWS Certified Developer - Associate",,,,,,,,,https://aws.amazon.com/partners/find/partnerdetails/?n=OAE%20Software&id=001E000000jpL0AIAU
KS Mobile,"Beijing, Beijing (Headquarters)",http://www.ksmobile.com,Select Technology Partner,,"AWS Certified Solutions Architect - Associate,AWS Certified Solutions Architect - Professional",,,,,,,,,https://aws.amazon.com/partners/find/partnerdetails/?n=KS%20Mobile&id=001E000000jpYs4IAE
Intelitek Inc.,"Manchester, NH (Headquarters)",http://www.intelitek.com,Select Technology Partner,"Intelitek is a global provider of technical education solutions that prepare students for career paths in Science, Technology and Engineering. We are a world leader in the development and manufacture of applied learning programs that integrate hardware, software and e-learning systems in Engineering, Advanced Manufacturing and Automation Technologies. Intelitek’s broad product line inc",,,,,,,,,,https://aws.amazon.com/partners/find/partnerdetails/?n=Intelitek%20Inc.&id=001E000000jpanZIAQ
Silverback MDM,"Sydney, New South Wales (Headquarters)",http://www.silverbackmdm.com,Select Technology Partner,,,,,,,,,,,https://aws.amazon.com/partners/find/partnerdetails/?n=Silverback%20MDM&id=001E000000jpnHmIAI
Espresso Logic,"Santa Clara, CA (Headquarters)",http://www.espressologic.com,Select Technology Partner,Espresso Logic provides a service targeted at Mobile and Web application developers that need to connect to backend relational databases in their applications. Espresso provides the following as part of its service Instant REST server for connecting with backend databases no matter where your database is located - in the cloud or on-premise. Currently supported databases includ,,,,,,,,,,https://aws.amazon.com/partners/find/partnerdetails/?n=Espresso%20Logic&id=001E000000jqgtKIAQ
MongoHQ,"San Mateo, CA (Headquarters)",http://www.mongohq.com,Select Technology Partner,,,,,,,,,,,https://aws.amazon.com/partners/find/partnerdetails/?n=MongoHQ&id=001E000000jqn0GIAQ
Proudit Inc.,"shibuya-ku, Tokyo (Headquarters)",http://www.proudit.jp,Select Consulting Partner,"We are the infrastructure engineering specialists. Our MSP service ""ProudCloud"" always grows up and develops. An example of the service Support service for ""Code as infrastructure"" which Configuration management Tool such as Ansible/Chef. Support service for ""Blue-Green DepoySystem"" by AWS ECS Support service for serverless constitution (Lambda","AWS Certified Developer - Associate,AWS Certified DevOps Engineer - Professional,AWS Certified Solutions Architect - Professional,AWS Certified Solutions Architect - Associate,AWS Certified Sysops Administrator - Associate",,,,,,,,,https://aws.amazon.com/partners/find/partnerdetails/?n=Proudit%20Inc.&id=001E000000jqpu4IAA
UROLIME TECHNOLOGIES PVT LTD,"Cochin, Kerala (Headquarters)",http://www.urolime.com,Select Consulting Partner,"Urolime has vast experience in DevOps & Cloud, Deployment and Infrastructure Automation, Application containerization and Highly available Infrastructure build. The customers benefit from our expert involvement in Deployment Automation (CI/CD), Infrastructure As a Code Automation, Dockerization, Kubernetes, Security, Disaster Recovery Planning and 24/7 Managed Services with 10 Minutes SLA.","AWS Certified Solutions Architect - Associate,AWS Certified Sysops Administrator - Associate",,,,,,,,,https://aws.amazon.com/partners/find/partnerdetails/?n=UROLIME%20TECHNOLOGIES%20PVT%20LTD&id=001E000000jqqmcIAA
Nitrous.IO,"Mountain View, California (Headquarters)",https://www.nitrous.io/,Select Technology Partner,"Nitrous.IO provides powerful, preconfigured Linux based development environments in the cloud that can be accessed from any modern web browser. Developers can create and start coding in a brand new Ruby, Python, Go, or NodeJS development environment in a matter of seconds.",,,,,,,,,,https://aws.amazon.com/partners/find/partnerdetails/?n=Nitrous.IO&id=001E000000jr22VIAQ
Sysgain Inc,"Remond, WA (Headquarters)",http://www.sysgain.com,Select Consulting Partner,"Sysgain Inc. is a cloud services consulting company that specializes in helping its clients digitally transform their business with cloud and DevOps solutions on AWS. Our services include cloud migrations, DevOps & automation, microservices, application development, and managed services.","AWS Certified Solutions Architect - Associate,AWS Certified Sysops Administrator - Associate",,,,,,,,,https://aws.amazon.com/partners/find/partnerdetails/?n=Sysgain%20Inc&id=001E000000jr3g3IAA
