Paessler AG,"Nuremberg, BY (Headquarters)",http://www.paessler.com,Select Technology Partner,"Paessler AG was founded in 1997 in the metropolitan region of Nuremberg and is now internationally represented in many markets, supporting our partners and customers locally. 200,000 sysadmins at organizations from small businesses through the Fortune 100 have used PRTG Network Monitor to make their networks faster, more responsive, and more reliable.","AWS Certified Solutions Architect - Professional,AWS Certified DevOps Engineer - Professional,AWS Certified Developer - Associate,AWS Certified Solutions Architect - Associate,AWS Certified Sysops Administrator - Associate",,,,,,,,,https://aws.amazon.com/partners/find/partnerdetails/?n=Paessler%20AG&id=001E000000UfZ2VIAV
PCPhase Corporation,"Shibuya-ku, Tokyo (Headquarters)",http://www.pcp.co.jp/,Select Consulting Partner,Mobile solution development and ASP services Mobile website operation and management Mobile marketing and sales promotion consulting Mobile game licensing services Mobile website and apps localization,AWS Certified Solutions Architect - Associate,,,,,,,,,https://aws.amazon.com/partners/find/partnerdetails/?n=PCPhase%20Corporation&id=001E000000UfZ2mIAF
Plutora,"Sydney, New South Wales (Headquarters)",http://www.plutora.com,Select Technology Partner,,,,,,,,,,,https://aws.amazon.com/partners/find/partnerdetails/?n=Plutora&id=001E000000UfZ32IAF
Rain,"American Fork, Utah (Headquarters)",http://www.mediarain.com,Select Consulting Partner,"Since 1999, Rain has been dedicated to delivering comprehensive solutions for advanced rich internet application and development, interactive digital media, creative, and marketing. Our expertise has been invaluable to such clients as Adobe, Sony, Hewlett- Packard, Universal Music, Skullcandy, Hess, Ancesry.com, Google, Cottonelle, The Children’s Miracle Network, and many others. Our int",AWS Certified Solutions Architect - Associate,,,,,,,,,https://aws.amazon.com/partners/find/partnerdetails/?n=Rain&id=001E000000UfZ3kIAF
Saberion (Pvt) Ltd,"Colombo, Western (Headquarters)",http://www.saberion.com,Select Consulting Partner,"Saberion has been operational for 11 years with over 1100 clients to date both locally (in Sri Lanka) and Internationally (United States, Australia, UK and Bahrain). Our adoption of cloud based services is in line with the companies growth strategy and demand from our clients. Our expertise is in understanding your organisations cloud needs and engineering a solution that best fits your company",AWS Certified Solutions Architect - Associate,,,,,,,,,https://aws.amazon.com/partners/find/partnerdetails/?n=Saberion%20(Pvt)%20Ltd&id=001E000000UfZ4iIAF
SBA Info Solutions Private Ltd,"Chennai, TN (Headquarters)",http://www.sbainfo.in,Select Consulting Partner,,AWS Certified Solutions Architect - Associate,,,,,,,,,https://aws.amazon.com/partners/find/partnerdetails/?n=SBA%20Info%20Solutions%20Private%20Ltd&id=001E000000UfZBZIA3
ScaleGrid,"Palo Alto, CA (Headquarters)",https://scalegrid.io,Select Technology Partner,"ScaleGrid Database-as-a-Service (DBaaS) is a fully managed hosting solution for MongoDB and Redis on AWS, Azure and DigitalOcean. The all-inclusive platform manages your entire database lifecycle, including provisioning, scale, high availability, upgrades, patches, monitoring, backups, restores, and migrations. Host with us through our Dedicated and Shared AWS plans, or bring your own AWS account.",,,,,,,,,,https://aws.amazon.com/partners/find/partnerdetails/?n=ScaleGrid&id=001E000000UfZBbIAN
SENIOR SISTEMAS SA,"Blumenau, SC (Headquarters)",http://www.senior.com.br,Select Technology Partner,"The Senior is a national reference in software for management. With one of the most complete portfolios for high performance, provides businesses of all sizes and segments solutions in Business Management, Logistics, Human Resources Management and Access and Security Management. Founded in 1988 in Blumenau (SC), operates throughout Brazil with branches, offices, business units and distribution cha",,,,,,,,,,https://aws.amazon.com/partners/find/partnerdetails/?n=SENIOR%20SISTEMAS%20SA&id=001E000000UfZBqIAN
Sequoyah Technologies,"Sapulpa, Oklahoma (Headquarters)",http://www.seqtek.com,Select Consulting Partner,"As one of the leading development shops in the midwest, Sequoyah offers a broad portfolio of cloud-enabled infrastructure, development expertise, and application solutions that include value-added services such as SaaS, near-shoring, security, cloud deployment and monitoring, CRM, ERP and business analytics.",,,,,,,,,,https://aws.amazon.com/partners/find/partnerdetails/?n=Sequoyah%20Technologies&id=001E000000UfZBsIAN
Sirvoy Ltd,"Castletown, Laois (Headquarters)",http://www.sirvoy.com,Select Technology Partner,,AWS Certified Solutions Architect - Associate,,,,,,,,,https://aws.amazon.com/partners/find/partnerdetails/?n=Sirvoy%20Ltd&id=001E000000UfZCPIA3
SMDI,"Arlington, VA (Headquarters)",http://www.smdi.com,Select Consulting Partner,"Synectics has provided IT services to clients in the Washington-Baltimore area for more than 30 years. During this time, we have enjoyed long-term relationships with federal and private-sector clients, including a number of divisions within the Department of Health and Human Services (HHS). We have extensive knowledge of and expertise in leading-edge technical services. We stay cu",AWS Certified Solutions Architect - Associate,,,,,,,,,https://aws.amazon.com/partners/find/partnerdetails/?n=SMDI&id=001E000000UfZCeIAN
ForgeAhead Solutions Inc.,"Mountain View, CA (Headquarters)",http://www.snstech.com,Select Consulting Partner,"Our specialization includes assisting companies in migration from standard datacenter operations to a complete cloud solution leveraging web services to the fullest when necessary that provides significant benefits over traditional solutions. Our strength lies primarily in a one-stop shop solutions wherein we are responsible for end-to-end i.e. assisting in defining requirements, through",AWS Certified Solutions Architect - Associate,,,,,,,,,https://aws.amazon.com/partners/find/partnerdetails/?n=ForgeAhead%20Solutions%20Inc.&id=001E000000UfZCiIAN
Speedchilli Ltd,"London, London (Headquarters)",http://www.speedchilli.com,Select Consulting Partner,,"AWS Certified Solutions Architect - Associate,AWS Certified Sysops Administrator - Associate",,,,,,,,,https://aws.amazon.com/partners/find/partnerdetails/?n=Speedchilli%20Ltd&id=001E000000UfZD2IAN
System Source,"Hunt Valley, MD (Headquarters)",http://www.syssrc.com,Select Consulting Partner,"System Source has been in business since 1981. System Source is a regional systems integrator. We have the people, processes and tools to help clients improve, maintain and acquire all things IT and AV. Clients ask our team of 80 employees to help IMPROVE their IT operations. Some ask us to TRAIN their staff in applications or technical topics for more productivity and lower help",AWS Certified Solutions Architect - Associate,,,,,,,,,https://aws.amazon.com/partners/find/partnerdetails/?n=System%20Source&id=001E000000UfZDrIAN
TDSIS Tecnologia LTDA,"São Paulo, São Paulo (Headquarters)",http://www.tdsis.com.br,Select Consulting Partner,"We develop and deliver pioneer solutions for financial institutions dealing with security, performance, fault tolerance, costs and many other matters. Our team is mastering software development using serverless architecture. We deliver solutions based on products and services like AWS Lambda, API Gateway, DynamoDB. Our development cycle count on AWS Code*, providing CI, CD e Infras as a Code.","AWS Certified Solutions Architect - Associate,AWS Certified Developer - Associate,AWS Certified Sysops Administrator - Associate",,,,,,,,,https://aws.amazon.com/partners/find/partnerdetails/?n=TDSIS%20Tecnologia%20LTDA&id=001E000000UfZE7IAN
TechBento IT & Cloud Management,"Portland, ME (Headquarters)",http://www.techbento.com,Select Consulting Partner,"TechBento, by Computer Doctors of Maine, Inc., is a boutique information technology supplier for businesses all over the United States. Our target demographic is professional services companies between 5 and 50 users. We provide on-premise and cloud information technology management that is agnostic of operating systems or special software. Among the solutions we offer is the integration of Am",,,,,,,,,,https://aws.amazon.com/partners/find/partnerdetails/?n=TechBento%20IT%20%26%20Cloud%20Management&id=001E000000UfZEDIA3
Kellton Tech,"Princeton, New Jersey (Headquarters)",https://www.kelltontech.com/,Select Consulting Partner,Kellton Tech is a global IT conglomerate offering customized cloud computing services and solutions to clients across the globe. We leverage the full potential of cloud with the right mix of traditional and IP-based digital capabilities to help our clients achieve agility and reduce the cost and complexity of computing.,"AWS Certified Solutions Architect - Professional,AWS Certified Developer - Associate,AWS Certified Solutions Architect - Associate,AWS Certified Sysops Administrator - Associate",,,,,,,,,https://aws.amazon.com/partners/find/partnerdetails/?n=Kellton%20Tech&id=001E000000UfZERIA3
The Cut Creative,"Perth, Western Australia (Headquarters)",http://www.thecut.net.au/,Select Technology Partner,"We build custom web applications and websites for a wide range of clients, in addition to general brand and print advertising.",,,,,,,,,,https://aws.amazon.com/partners/find/partnerdetails/?n=The%20Cut%20Creative&id=001E000000UfZLqIAN
Thismoment Content Cloud,"San Francisco, CA (Headquarters)",http://www.thismoment.com,Select Technology Partner,"Thismoment is a pioneer in the development of Social Content Management Software for brands. Its Distributed Engagement Channel (DEC) is a real-time platform for managing a brand's digital presence, including social content, conversation and creative assets across earned, owned and paid media channels on web, tablet, mobile, and digital outdoor devices. Launched in March 2010, DEC is already used","AWS Certified Solutions Architect - Associate,AWS Certified Developer - Associate,AWS Certified Sysops Administrator - Associate",,,,,,,,,https://aws.amazon.com/partners/find/partnerdetails/?n=Thismoment%20Content%20Cloud&id=001E000000UfZLzIAN
TL Consulting Group,"Sydney, New South Wales (Headquarters)",http://www.tlconsulting.com.au/,Select Consulting Partner,"TL Consulting Group offers consulting services in areas of Cloud Migration, DevOps, CI/CD, TestOps and Test Environment & Data Management. We help accelerate your cloud migration journey through intelligent automation across the infrastructure, application, and data layer. Our technology partners incl. AWS, Docker, Mesosphere, enov8, Tracer Cloud and eSecure.",AWS Certified Solutions Architect - Associate,,,,,,,,,https://aws.amazon.com/partners/find/partnerdetails/?n=TL%20Consulting%20Group&id=001E000000UfZM7IAN
Torry Harris Business Solutions,"Bristol, Bristol (Headquarters)",http://www.thbs.com,Select Consulting Partner,"Torry Harris Business Solutions (THBS) is a multinational provider of business, technology and consulting services. Torry Harris helps its clients meeting their business objectives within digital area. It provides IT consulting and services in the areas of SOA/API, Digital Enablement, Gamification, IoT/IoE, Mobility, Cloud Integration and Big Data. THBS provides software services to enterprise cli","AWS Certified Solutions Architect - Associate,AWS Certified Developer - Associate,AWS Certified Sysops Administrator - Associate",,,,,,,,,https://aws.amazon.com/partners/find/partnerdetails/?n=Torry%20Harris%20Business%20Solutions&id=001E000000UfZMCIA3
TriCore Solutions,"Norwell, MA (Headquarters)",http://www.tricoresolutions.com,Select Consulting Partner,"TriCore Solutions, the application management experts, provides a full suite of scalable and reliable managed application, cloud and infrastructure hosting, and consulting services to enterprise organizations. With 17 years of experience, the Company delivers its services and the TriCore Trusted Promise to more than 260 enterprise-class companies worldwide to reduce costs, raise service levels, im","AWS Certified Solutions Architect - Associate,AWS Certified Sysops Administrator - Associate,AWS Certified Developer - Associate",,,,,,,,,https://aws.amazon.com/partners/find/partnerdetails/?n=TriCore%20Solutions&id=001E000000UfZMKIA3
Two Bulls,"Collingwood, Victoria (Headquarters)",http://www.twobulls.com,Select Consulting Partner,"We are creative developers, producing award-winning digital products & solutions that push the boundaries of what’s possible with today’s devices. We design and develop apps, services, products and ecosystems for mobile, desktop and emerging platforms. We work with start-ups and established brands, from concept to delivery. Our diverse client list includes Qualcomm, Schweppes, Deloitte, Merrill",AWS Certified Solutions Architect - Associate,,,,,,,,,https://aws.amazon.com/partners/find/partnerdetails/?n=Two%20Bulls&id=001E000000UfZMaIAN
UIB Holdings Pte Ltd,"Singapore, Singapore (Headquarters)",https://www.uib.ai,Select Technology Partner,"UIB's intelligent IoT messaging device- and platform-agnostic UnificationEngine(UE) technology uses Artificial Intelligence (AI) and Natural Language Processing (NLP) to enable home users to control and manage devices on over 20 of the world's most popular global communications channels, including: SMS, Facebook, WhatsApp, Viber, Skype, and many others.",,,,,,,,,,https://aws.amazon.com/partners/find/partnerdetails/?n=UIB%20Holdings%20Pte%20Ltd&id=001E000000UfZMeIAN
Ventuno Technologies Private Limited,"Chennai, Tamil Nadu (Headquarters)",http://www.ventunotech.com/en/,Select Technology Partner,"Ventuno is one of the leading video solutions provider based out of Chennai, India. Ventuno provides both technology and media solutions for video. Our technology solutions include an online video platform and a video ad server. Our media solution inlcudes a content syndication platform that reaches, engages and monetizes audience across screens.",,,,,,,,,,https://aws.amazon.com/partners/find/partnerdetails/?n=Ventuno%20Technologies%20Private%20Limited&id=001E000000UfZMyIAN
Vishwak,"Redmond, WA (Headquarters)",http://www.vishwak.com/,Select Consulting Partner,"Vishwak Solutions, Inc. is an IT Consulting & Services firm based in Redmond (WA) with its ODC in Chennai. Companies like Microsoft, Thanthi, Malar, Eenadu media Groups, Serba Dinamik, Fortis, Amway kind of customers who look upon us for their Solutions Architecting. Our experts on AWS, Microsoft, Open source stacks that provide solutions on CMS, EAI, BI, KM, Enterprise Mobility.",AWS Certified Solutions Architect - Associate,,,,,,,,,https://aws.amazon.com/partners/find/partnerdetails/?n=Vishwak&id=001E000000UfZNCIA3
WDEV Solu??es em Tecnologia,"Rio de Janeiro, RJ (Headquarters)",http://www.wdev.com.br,Select Technology Partner,"WDEV is a company with experience in developing technological solutions to the insurance industry. The company aims to participate in the value of the insurance market providing innovative solutions chain, offering the most diverse products and own systems and specialized professionals.",,,,,,,,,,https://aws.amazon.com/partners/find/partnerdetails/?n=WDEV%20Solu%3F%3Fes%20em%20Tecnologia&id=001E000000UfZNUIA3
Webdunia Pvt Ltd,"Indore, Madhya Pradesh (Headquarters)",http://www.webdunia.net,Select Technology Partner,,,,,,,,,,,https://aws.amazon.com/partners/find/partnerdetails/?n=Webdunia%20Pvt%20Ltd&id=001E000000UfZNZIA3
AAPT,"Sydney, New South Wales (Headquarters)",http://aapt.com.au,Select Technology Partner,"National AWS Connect AAPT's National AWS Connect product establishes a dedicated private network connection from your data centre, office, or Co-Location environment to Amazon's new Australia Web Services Infrastructure. PRODUCT BACKGROUND AAPT's National AWS Connect product establishes a dedicated private network connection from your data centre, office, or Co-",AWS Certified Solutions Architect - Associate,,,,,,,,,https://aws.amazon.com/partners/find/partnerdetails/?n=AAPT&id=001E000000UfZOnIAN
Actian Corporation,"Palo Alto, CA (Headquarters)",http://www.actian.com,Select Technology Partner,"At Actian, we deliver data as a competitive advantage to thousands of customers worldwide. Through the deployment of remarkable data management and data integration technologies, underpinned by a relentless and trusted service commitment, we ensure that business critical systems can transact and integrate at their very best – on premise, in the cloud or both. For more, visit http://www.actian.com.","AWS Certified Sysops Administrator - Associate,AWS Certified Developer - Associate,AWS Certified Solutions Architect - Associate,AWS Certified Solutions Architect - Professional",,,,,,,,,https://aws.amazon.com/partners/find/partnerdetails/?n=Actian%20Corporation&id=001E000000UfZVRIA3
Adaptive Computing,"PROVO, UT (Headquarters)",http://www.adaptivecomputing.com,Select Technology Partner,"Cloud computing addresses many of the issues surrounding resource ownership and speed of deployment, but need for efficient resource administration and utilization remain the same. At the heart of these issues is the need for human intervention to schedule jobs, define job priorities and resolve scheduling conflicts, match workload requirements with available resources, and enforce usage rights",,,,,,,,,,https://aws.amazon.com/partners/find/partnerdetails/?n=Adaptive%20Computing&id=001E000000UfZVaIAN
Adslot Ltd,"South Melbourne, Victoria (Headquarters)",https://www.adslot.com/,Select Technology Partner,"Adslot is a leading global provider of Automated Guaranteed technology for premium online display inventory. Our vision is to automate the trading of media and to bring scale and efficiency to the digital media marketplace. To achieve this, we bring buyers and sellers together through our unique philosophy of openness, partnership and interoperability.","AWS Certified Solutions Architect - Professional,AWS Certified Solutions Architect - Associate,AWS Certified Developer - Associate",,,,,,,,,https://aws.amazon.com/partners/find/partnerdetails/?n=Adslot%20Ltd&id=001E000000UfZVeIAN
Aress Software,"Maharashtra, India (Headquarters)",https://www.aress.com,Select Consulting Partner,"We understand that every business is different, and therefore you will have specific needs from AWS. We offer services that are suited to both companies with an existing AWS estate and those that have never used AWS before, so no matter whether you are interested in migrating your current system over AWS or you already have a good understanding on AWS.","AWS Certified Solutions Architect - Associate,AWS Certified Sysops Administrator - Associate",,,,,,,,,https://aws.amazon.com/partners/find/partnerdetails/?n=Aress%20Software&id=001E000000UfZWGIA3
Assembla,"Weston, MA (Headquarters)",http://www.assembla.com/,Select Technology Partner,"Assembla provides on-demand workspaces for software teams. We provide git, subversion, ticketing and issue management, and collaboration tools. Assembla helps you take advantage of cloud computing by moving your code and development into the cloud. There, you can easily deploy it to staging and production servers with build and ftp to",,,,,,,,,,https://aws.amazon.com/partners/find/partnerdetails/?n=Assembla&id=001E000000UfZWNIA3
Astadia,"Jacksonville, FL (Headquarters)",https://www.astadia.com,Select Consulting Partner,"Astadia works with clients to modernize their IT investments to accelerate time to value, increase productivity, decrease risk, and optimize costs. We accomplish this through cloud development, platform migrations and managed services. We have the flexibility to meet our clients anywhere in their lifecycle journey to drive business value and partner as an extension of their organizations.","AWS Certified Solutions Architect - Associate,AWS Certified Developer - Associate",,,,,,,,,https://aws.amazon.com/partners/find/partnerdetails/?n=Astadia&id=001E000000UfZWOIA3
AVAI Mobile,"Austin, TX (Headquarters)",http://www.avaimobile.com,Select Technology Partner,"AVAI Mobile Solutions is an industry-leading, full-service mobile application development firm based in Austin, Texas. AVAI Mobile Solutions is best known as the developer of AMP™ - the AVAI Mobile Platform. AMP™ was created to empower associations and companies to properly leverage the mobile revolution to enhance their organizational effectiveness. AMP™ is a powerful plat",AWS Certified Solutions Architect - Associate,,,,,,,,,https://aws.amazon.com/partners/find/partnerdetails/?n=AVAI%20Mobile&id=001E000000UfZWXIA3
Aviarc Global Limited,"North Island, New Zealand (Headquarters)",http://www.aviarc.com/,Select Technology Partner,"Award winning Aviarc and Aviarc Drawingboard from Core Technology are heralded by global experts as uniquely meeting the demand for a simple to use, socially collaborative enterprise class development tool that makes it simple for new ideas and innovations to be shared between people. It’s as easy as social networking and pinning notes on a pin board, as easy as working the way you like to work",,,,,,,,,,https://aws.amazon.com/partners/find/partnerdetails/?n=Aviarc%20Global%20Limited&id=001E000000UfZWaIAN
Blue River Interactive Group,"Rancho Cordova, CA (Headquarters)",http://www.getmura.com,Select Technology Partner,"Blue River Interactive Group are a web development agency and the creators of the open source content management system, Mura CMS.",,,,,,,,,,https://aws.amazon.com/partners/find/partnerdetails/?n=Blue%20River%20Interactive%20Group&id=001E000000UfZX0IAN
Determine,"ATLANTA, Georgia (Headquarters)",http://www.b-pack.com,Select Technology Partner,"b-pack is a leading provider of purchase-to-pay, e-procurement, contract management and invoicing solutions on the cloud. We help many organizations around the globe in any industry to automate, gain visibility and save money on their spends. Our proven solutions are backed by more than 12 years of expertise and innovation. b-pack is well recognized by leading analysts such as Gartner.","AWS Certified Solutions Architect - Associate,AWS Certified Sysops Administrator - Associate",,,,,,,,,https://aws.amazon.com/partners/find/partnerdetails/?n=Determine&id=001E000000UfZXBIA3
CatchPoint Systems,"New York, New York (Headquarters)",http://www.catchpoint.com/,Select Technology Partner,"Catchpoint is a provider of performance monitoring solutions that test, monitor and optimize web sites, dns infrastructures & web services from a global network of probes. More than 70 customers, including Dyn, Edgecast, 24/7 RealMedia and many others, use Catchpoint to ensure a flawless quality of experience to their end users. Our next-generation Internet monitoring solutions increase pro",,,,,,,,,,https://aws.amazon.com/partners/find/partnerdetails/?n=CatchPoint%20Systems&id=001E000000UfZXbIAN
Ceonex,"Swampscott, Massachusetts (Headquarters)",http://www.ceonex.com,Select Technology Partner,"Ceonex has been migrating back office applications and networks to the Amazon Cloud since 2010. Our own network was fully migrated to cloud based solutions at that time. We also have developed and offer Cloud hosted SAS solutions hosted on AWS as well as built and deployed customer web sites to AWS. Our latest site, programmed for a social start up, is",,,,,,,,,,https://aws.amazon.com/partners/find/partnerdetails/?n=Ceonex&id=001E000000UfZXjIAN
Cequens,"Nasr City, Cairo (Headquarters)",http://www.cequens.com,Select Technology Partner,"Cequens is a leading technology corporation specialized in Mobile messaging services and solutions. Cequens has extensive know-how and a proven track record of the telecommunication messaging technologies and applications, serving hundreds of renowned customers in more than 40 countries worldwide. Our international customer base consists of: Mobile telecom operators Aggr","AWS Certified Sysops Administrator - Associate,AWS Certified Solutions Architect - Associate,AWS Certified Developer - Associate",,,,,,,,,https://aws.amazon.com/partners/find/partnerdetails/?n=Cequens&id=001E000000UfZXkIAN
Chemtech - A Siemens Business,"Rio de Janeiro, Rio de Janeiro (Headquarters)",http://www.chemtech.com.br,Select Consulting Partner,"Established in 1989, Chemtech is a Brazilian leading company for multidisciplinary engineering, consulting and Industrial IT projects. Being part of Siemens since 2001, Chemtech has delivered challenging projects all over the world, focusing on innovative solutions for process industries such as Oil & Gas, Metals & Mining, Chemical & Petrochemical and Energy. Offices in RH (HQ), SP, BH, Salvador.",AWS Certified Solutions Architect - Associate,,,,,,,,,https://aws.amazon.com/partners/find/partnerdetails/?n=Chemtech%20-%20A%20Siemens%20Business&id=001E000000UfZXpIAN
Cinergix Pty Ltd,"Mentone, Victoria (Headquarters)",http://creately.com,Select Technology Partner,,,,,,,,,,,https://aws.amazon.com/partners/find/partnerdetails/?n=Cinergix%20Pty%20Ltd&id=001E000000UfZXsIAN
"Circonus, Inc.","Fulton, MD (Headquarters)",http://circonus.com,Select Technology Partner,"Circonus enables engineers to better understand the behavior of their systems. With Circonus engineers can visualize any data, in any application, from any system (cloud or legacy), in real-time. Circonus scales from a single team, to a worldwide organization with thousands of devices tracking millions of metrics. Our API driven automation supports efficiency and allows developers to treat obst",,,,,,,,,,https://aws.amazon.com/partners/find/partnerdetails/?n=Circonus%2C%20Inc.&id=001E000000UfZXwIAN
